rating,rank,cover_url,is_playable,id,types,regions,title,url,release_date,actor_count,vote_count,score,actors,is_watched
6.6 35,2405,https://img1.doubanio.com/view/photo/s_ratio_poster/public/p1599028307.jpg,True,1905788,喜剧 剧情 爱情 运动,美国 德国,爱情达阵,https://movie.douban.com/subject/1905788/,2008-04-04,40,1989,6.6,乔治·克鲁尼 蕾妮·齐薇格 约翰·卡拉辛斯基 斯蒂芬·鲁特 韦恩·杜瓦尔 Jerry Cashman Don Calhoun Tom Huff Kevin Woods Jason Drago 大卫·帕斯奎斯 Tom Glynn 海瑟·戈尔登赫什 Zack Kay 彼得·格雷蒂 罗伯特·贝克尔 马克斯·凯塞拉 迈克·奥麦利 格兰特·赫斯洛夫 兰迪·纽曼 Trey Moore 克里斯蒂安·斯托特 汤米·欣克利 乔纳森·普雷斯 JD·库鲁姆 大卫·德弗里斯 Mark Teich 马特·布谢尔 Sandra W. Van Natta Craig S. Harper 罗恩·克林顿·史密斯 杰克·汤普森 玛丽安·塞尔德斯 杰雷米·拉特福德 Ryan Shively Nick Paonessa 约翰·麦康奈尔 Dave Hager Robert Hy Gorman 布莱克·克拉克,False
6.6 35,2406,https://img3.doubanio.com/view/photo/s_ratio_poster/public/p2550080022.jpg,False,30158840,喜剧 爱情,美国,大人物,https://movie.douban.com/subject/30158840/,2019-04-19,17,1985,6.6,吉娜·罗德里格兹 勒凯斯·斯坦菲尔德 布兰特妮·斯诺 德汪达·怀斯 蜜雪儿·伯托 丽贝卡·纳奥米·琼斯 亚历克斯·莫法特 乔·洛西塞罗 彼得·瓦克 梅根·海利 本·锡德尔 雅布其·杨-怀特 罗莎里奥·道森 鲁保罗 托马斯·科帕切 费斯·洛根 曼哈顿·尼夫斯,False
6.6 35,2407,https://img9.doubanio.com/view/photo/s_ratio_poster/public/p738928845.jpg,True,1307872,喜剧 爱情,中国香港,青蛙王子,https://movie.douban.com/subject/1307872/,1984-04-18,17,1976,6.6,钟镇涛 张曼玉 关之琳 钟楚红 陈百祥 金燕玲 万梓良 王天林 曹查理 刘准 刘秀萍 林志泰 陈惠敏 张坚庭 欧阳莎菲 吴丽珠 郭军城,False
6.6 35,2408,https://img1.doubanio.com/view/photo/s_ratio_poster/public/p2271622588.jpg,False,19949260,剧情 爱情,意大利 法国,爱情初学者,https://movie.douban.com/subject/19949260/,2015-10-23,12,1970,6.6,埃利奥·杰曼诺 阿斯特丽德·伯格斯-弗瑞斯贝 瓦莱里奥·比纳斯科 艾琳娜·蕾多娜希奇 Pino Colizzi 马尔科·达莫雷 罗什迪·泽姆 泽维尔·勒梅特 Maria Sole Mansutti Anis Gharbi Nicola Sisti Ajmone 阿尔芭·洛尔瓦彻,False
6.6 35,2409,https://img3.doubanio.com/view/photo/s_ratio_poster/public/p2547047530.jpg,False,1296035,恐怖 爱情 战争,泰国,鬼妻,https://movie.douban.com/subject/1296035/,2000-04-06,1,1949,6.6,因泰拉·贾龙珀拉,False
6.6 35,2410,https://img1.doubanio.com/view/photo/s_ratio_poster/public/p1814587489.jpg,False,10466642,剧情 喜剧 爱情,美国,伴我梦游,https://movie.douban.com/subject/10466642/,2012-08-24,8,1889,6.6,劳伦·艾波罗丝 迈克·比尔比利亚 阿尔贝托·博尼拉 艾米丽·梅德 詹姆斯·瑞布霍恩 阿雅·卡什 克里斯汀·沙尔 艾米·舒默,False
6.6 35,2411,https://img9.doubanio.com/view/photo/s_ratio_poster/public/p2538022666.jpg,False,1303218,喜剧 剧情 歌舞 爱情,中国香港,仙乐飘飘,https://movie.douban.com/subject/1303218/,1995-08-16,9,1826,6.6,郭富城 陈慧琳 吴耀汉 苗侨伟 戚美珍 许芬 陈海恒 林爱华 陈敏婷,False
6.6 35,2412,https://img9.doubanio.com/view/photo/s_ratio_poster/public/p1300706256.jpg,False,3011092,剧情 爱情,美国,格雷塔,https://movie.douban.com/subject/3011092/,2009-12-11,12,1806,6.6,希拉里·达芙 艾伦·伯斯汀 伊万·罗斯 迈克尔·墨菲 梅丽莎·里奥 约翰·罗斯曼 奥伦·斯科格 戴夫·沙兰斯基 史尼娜·乔尔森 凯利·苏利文 Paul Thornton Robert Oppel,False
6.6 35,2413,https://img3.doubanio.com/view/photo/s_ratio_poster/public/p1196918422.jpg,True,1309093,喜剧 剧情 歌舞 爱情,英国 美国,新娘与偏见,https://movie.douban.com/subject/1309093/,2004-10-08,23,1768,6.6,艾西瓦娅·雷 马丁·亨德森 阿努潘·凯尔 纳威恩·安德利维斯 娜姆拉塔·施洛德卡 丹尼尔·吉里斯 因迪拉·瓦玛 Sonali Kulkarni Nitin Ganatra 阿丽克西斯·布莱德尔 玛莎·马森 亚香缇 乔治娜·查普曼 里克·沃登 萨拉·芭努 顾伦德·查达哈 普莱姆 曹帕拉 迈克尔·多特森 哈维·韦恩斯坦 彼得·雷尼克 Anu Malik Neal Orion Rahul Nath,False
6.6 35,2414,https://img3.doubanio.com/view/photo/s_ratio_poster/public/p2453136952.jpg,False,26919823,剧情 爱情 同性,日本,向阳之处必有声,https://movie.douban.com/subject/26919823/,2017-06-24,7,1760,6.6,多和田秀弥 小野寺晃良 三津谷亮 高岛礼子 山崎亚美 井桁弘恵  松田リマ,False
6.6 35,2415,https://img1.doubanio.com/view/photo/s_ratio_poster/public/p1910918178.jpg,True,1291871,剧情 奇幻 恐怖 爱情 惊悚,美国,豹人,https://movie.douban.com/subject/1291871/,1982-04-02,12,1737,6.6,马尔科姆·麦克道威尔 娜塔莎·金斯基 约翰·赫德 Berry Berenson 约翰·拉罗凯特 弗兰基·费森 斯科特·帕林 琳恩·劳里 小艾德·博格里 露比·迪 安妮特·奥图 户田惠子,False
6.6 35,2416,https://img9.doubanio.com/view/photo/s_ratio_poster/public/p2341092955.jpg,True,1307780,动作 爱情,中国香港,明月照尖东,https://movie.douban.com/subject/1307780/,1992-05-21,8,1737,6.6,黎明 张学友 关之琳 吴孟达 李殿朗 程东 夏占士 楚爵年,False
6.6 35,2417,https://img1.doubanio.com/view/photo/s_ratio_poster/public/p2512507397.jpg,False,1580313,喜剧 爱情,South Korea,我爱上了朋友的姐姐,https://movie.douban.com/subject/1580313/,1998-06-16,8,1709,6.6,安在旭 金惠秀 姜声振 崔哲浩 姜京宪 权海骁 尹亨国 曹善默,False
6.6 35,2418,https://img3.doubanio.com/view/photo/s_ratio_poster/public/p2204670132.jpg,False,1473919,喜剧 爱情,中国香港,小男人周记,https://movie.douban.com/subject/1473919/,1989-05-20,11,1605,6.6,郑丹瑞 郑裕玲 钟楚红 文隽 李美凤 胡慧中 张坚庭 邓萃雯 黎彼得 周美凤 周慧敏,False
6.6 35,2419,https://img9.doubanio.com/view/photo/s_ratio_poster/public/p2540391476.jpg,False,2173889,剧情 爱情 同性,日本,给不知何时的你,https://movie.douban.com/subject/2173889/,2007-07-28,5,1562,6.6,坂本真 斋藤工 德井优 津田宽治 河合龙之介,False
6.6 35,2420,https://img9.doubanio.com/view/photo/s_ratio_poster/public/p2177056005.jpg,False,3026008,喜剧 剧情 爱情,韩国,肩外的恋人,https://movie.douban.com/subject/3026008/,2007-10-18,8,1556,6.6,李美妍 李泰兰 金俊成 尹宰文 金炳春 刘仁秀 朴贤英 元钟礼,False
6.6 35,2421,https://img1.doubanio.com/view/photo/s_ratio_poster/public/p2328420608.jpg,False,1299363,冒险 剧情 爱情,美国,第一武士,https://movie.douban.com/subject/1299363/,1995-07-07,30,1480,6.6,肖恩·康纳利 理查·基尔 朱莉娅·奥蒙德 本·克劳斯 利亚姆·坎宁安 Bob Zucker Derek Pykett 简·罗宾斯 Ryan Todd 丹尼尔·纳普勒斯 户田惠子 Kate Zucker Burton Zucker 萨沙·本奈特 伯纳德·希尔 埃里克斯·德尼索夫 马克·瑞安 克里斯托弗·维利尔斯 斯图尔特·邦斯 乔纳森·凯克 夏洛特扎克 瓦伦丁·佩尔卡 内维尔·菲利普斯 Colin McCormack 拉尔夫·伊内森 罗斯·基冈 Paul Kynman 哈里·弗雷德尔 罗伯·布莱顿 约翰·吉尔古德,False
6.6 35,2422,https://img1.doubanio.com/view/photo/s_ratio_poster/public/p2549621377.jpg,True,1304384,喜剧 悬疑 爱情,美国,神魂颠倒,https://movie.douban.com/subject/1304384/,2001-02-02,21,1457,6.6,莫妮卡·波特 小弗雷迪·普林兹 莎洛姆·哈罗 伊万娜·米利塞维奇 Norma MacMillan Sarah Murdoch Robert Musnicki 汤姆肖特豪斯 汤贾·雷切特 朱迪·汤普森 杰瑞·瓦塞尔曼 詹姆斯·柯克 盖瑞·琼斯 约翰·麦克唐纳 努特·西雅 蒂莫西·奥利芬特 布雷丹·贝塞尔 克里斯蒂娜·科普兰 杰伊·布拉泽奥 Raoul Ganeev 周佳纳,False
6.6 35,2423,https://img1.doubanio.com/view/photo/s_ratio_poster/public/p2192321969.jpg,True,1870683,喜剧 剧情 爱情,美国,捉放爱,https://movie.douban.com/subject/1870683/,2006-10-20,16,1397,6.6,詹妮弗·加纳 蒂莫西·奥利芬特 朱丽叶特·刘易斯 山姆·贾格 Darren Daurie 加布里埃尔·罗斯 乔治娅·克雷格 Joshua Friesen 费奥纳·肖 凯文·史密斯 桑娅·本妮特 Nancy Hower 克里斯托弗·雷德曼 詹妮弗·斯宾塞 迈克尔·亚当思韦特 莱斯利·麦克迈克尔,False
6.6 35,2424,https://img1.doubanio.com/view/photo/s_ratio_poster/public/p1192109989.jpg,False,1422916,喜剧 歌舞 爱情,美国,爱情和香烟,https://movie.douban.com/subject/1422916/,2005-09-06,31,1350,6.6,詹姆斯·甘多菲尼 苏珊·萨兰登 凯特·温丝莱特 史蒂夫·布西密 曼迪·摩尔 克里斯托弗·沃肯 Jeannette Gould 约翰·特托罗 Robert Morgan 杰克·坎纳瓦尔 John Kelly John Selya Diego Turturro Tom Nobles 大卫·桑顿 艾达·特托罗 托尼·戈德温 鲍比·坎纳瓦尔 Ivan Fatovic 玛丽-露易丝·帕克 库玛·帕拉纳 艾迪·伊扎德 巴巴拉·苏科瓦 阿梅代奥·图尔图罗 艾米·塞德丽丝 托尼娅·皮金斯 亚当·勒费弗 Mary Bond Davis P.J. Brown 凯瑟琳·博罗维茨 伊莲妮·斯楚奇,False
6.6 35,2425,https://img3.doubanio.com/view/photo/s_ratio_poster/public/p2515587023.jpg,False,1303204,剧情 喜剧 爱情 情色,中国香港,晚9朝5,https://movie.douban.com/subject/1303204/,1994-04-08,6,1336,6.6,陈豪 周嘉玲 陈小春 恩尼奥·莫里康内 陈可辛 邱秋月,False
6.6 35,2426,https://img9.doubanio.com/view/photo/s_ratio_poster/public/p2538512144.jpg,False,30198694,喜剧 爱情,意大利,把外婆放进冰箱,https://movie.douban.com/subject/30198694/,2018-03-15,14,1329,6.6,法比奥·德·路易吉 米丽娅姆·莱昂内 露西娅·奥康 玛丽娜·罗科 弗朗西斯科·迪·莱瓦 苏西·劳德 卡罗·卢卡·德·鲁杰里 毛里齐奥·隆巴迪 爱洛斯·帕尼 芭芭拉·布薛特 乔瓦尼·埃斯波西托 保罗·贝塞加托 南多·艾琳 安东内洛·莫雷利,False
6.6 35,2427,https://img1.doubanio.com/view/photo/s_ratio_poster/public/p1632262578.jpg,False,11500346,剧情 爱情,韩国,别担心，我是女鬼,https://movie.douban.com/subject/11500346/,2012-07-15,3,1313,6.6,朴信惠 奉太奎 南奎丽,False
6.6 35,2428,https://img3.doubanio.com/view/photo/s_ratio_poster/public/p2326444810.jpg,True,3215548,剧情 爱情,中国香港,心动,https://movie.douban.com/subject/3215548/,1986-11-20,8,1289,6.6,江显扬 王祖贤 吴夏萍 石修 鲍起静 邹世孝 钱似莺 甘国卫,False
6.6 35,2429,https://img3.doubanio.com/view/photo/s_ratio_poster/public/p2182574051.jpg,False,25794037,喜剧 爱情,美国,平淡无奇的孩子,https://movie.douban.com/subject/25794037/,2014-06-06,10,1278,6.6,珍妮·斯蕾特 杰克·莱西 盖比·霍夫曼 Gabe Liedman 大卫·克罗斯 理查德·坎德 波利·德雷珀 张欣迪 Steve Jaffe 詹妮弗·金,False
6.6 35,2430,https://img1.doubanio.com/view/photo/s_ratio_poster/public/p2322497569.jpg,False,26388981,剧情 爱情 歌舞,美国 罗马尼亚,舞力重击,https://movie.douban.com/subject/26388981/,2016-04-08,11,1264,6.6,琪楠·坎帕 尼古拉斯·加利齐纳 水野索诺娅 简·西摩 理查德·索斯盖特 保罗·弗里曼 马库斯·伊曼纽尔·米切尔 玛雅·摩根斯坦特 安娜贝尔·库帖 康福特·费达克 马库斯·米歇尔,False
6.6 35,2431,https://img9.doubanio.com/view/photo/s_ratio_poster/public/p1457124466.jpg,True,1947655,犯罪 剧情 爱情 惊悚,英国 法国,遥远的北方,https://movie.douban.com/subject/1947655/,2007-08-30,6,1259,6.6,杨紫琼 肖恩·宾 杨雅慧 Per Egil Aske Gary Pillai 苏菲·吴,False
6.6 35,2432,https://img1.doubanio.com/view/photo/s_ratio_poster/public/p2488818717.jpg,True,1302345,喜剧 爱情,美国,似曾相识,https://movie.douban.com/subject/1302345/,2001-06-07,23,1241,6.6,艾什莉·贾德 格雷戈·金尼尔 休·杰克曼 皮特·弗雷德曼 Sabine Singh 哈罗德·佩里诺 劳拉·里根 Hugh Downs Nicole Leach David Kener 唐娜·汉诺威 艾伦·巴金 基思·雷丁 娜奥米·贾德 考林·加普 舒勒·汉斯利 薇诺妮卡·韦伯 克里斯滕·里特 玛丽莎·托梅 托尼·戈德温 Daniella Canterman 凯瑟琳·丹特  朱莉·卡夫娜,False
6.6 35,2433,https://img3.doubanio.com/view/photo/s_ratio_poster/public/p2541893830.jpg,False,3056650,剧情 爱情,中国台湾,一颗红豆,https://movie.douban.com/subject/3056650/,1979-01-28,8,1207,6.6,张永雄 马永霖 张冲 唐宝云 秦汉 曹健 林青霞 李伟,False
6.6 35,2434,https://img1.doubanio.com/view/photo/s_ratio_poster/public/p2354352378.jpg,False,3042107,爱情,中国香港,百分百啱Feel,https://movie.douban.com/subject/3042107/,1996-12-21,11,1176,6.6,郑伊健 郑秀文 梁咏琪 葛民辉 张达明 邱淑贞 许志安 罗家英 谢天华 兰茜 邹凯光,False
6.6 35,2435,https://img9.doubanio.com/view/photo/s_ratio_poster/public/p2382265424.jpg,False,26587723,剧情 喜剧 爱情 同性,美国,我的初恋女孩,https://movie.douban.com/subject/26587723/,2016-01-24,10,1161,6.6,迪兰·格鲁拉 布里安娜·希德布兰德 马特奥·阿里亚斯 帕梅拉·阿德龙 蒂姆·海德克 卡梅伦·埃斯波西托 埃里克·格里芬 珍妮弗·普雷迪格 安娜·德拉·克鲁兹 劳拉·帕塔拉诺,False
6.6 35,2436,https://img9.doubanio.com/view/photo/s_ratio_poster/public/p2557298395.jpg,True,1307957,动作 爱情 冒险 武侠 古装,中国香港,金燕子,https://movie.douban.com/subject/1307957/,1968-04-03,27,1159,6.6,郑佩佩 罗烈 徐松鹤 白妤 王青 王光裕 黎恩 黄梅 卢慧 伍元勋 邓祥 黄青云 杜文波 王羽 何柏光 闵敏 唐佳 井淼 谷峰 午马 杨志卿 赵心妍 刘家荣 袁祥仁 刘家良 谭宝 杨柏尘,False
6.6 35,2437,https://img1.doubanio.com/view/photo/s_ratio_poster/public/p1639086899.jpg,False,1761184,喜剧 爱情,韩国,光植的弟弟光泰,https://movie.douban.com/subject/1761184/,2005-11-23,8,1129,6.6,金雅中 金柱赫 郑京浩 李枖原 奉太奎 朴哲民 朴贤淑 金炯民,False
6.6 35,2438,https://img3.doubanio.com/view/photo/s_ratio_poster/public/p2537166093.jpg,True,1941404,喜剧 爱情,美国,谁都想成为意大利人,https://movie.douban.com/subject/1941404/,2007-09-18,14,1083,6.6,席瑞娜·文森 约翰·卡普洛斯 约翰·伊诺斯三世 玛丽萨·佩特罗 Shelby O'Connell Martin Moakler Grady Justice Kevin Cirone Courtney Andresen Judith Scarpone P.J. Marino 理查德·利伯蒂尼 丹·考特斯 潘妮·马歇尔,False
6.6 35,2439,https://img3.doubanio.com/view/photo/s_ratio_poster/public/p1523593363.jpg,False,1302376,喜剧 爱情,美国,万诱女孩,https://movie.douban.com/subject/1302376/,2000-09-01,22,1061,6.6,乔纳森·塔克 埃曼纽尔·施莱琪 詹姆斯·德贝罗 凯瑟琳·海格尔 拉丽莎·奥蕾尼克 杰米·普莱斯利 玛丽萨·瑞比茜 爱米·格拉汉姆 Terence Michael Ehud Bleiberg Tanisha Grant Kimberly Reeves Anita Thomas Allen Payne 艾瑞克·兹曼达 克里斯汀娜·安娜波 Chris Bustard 琼·布莱尔 Ivana Bozilovic Danielle Hoover Gina Hiraizumi 丹尼斯·马达洛尼,False
6.6 35,2440,https://img9.doubanio.com/view/photo/s_ratio_poster/public/p1755621536.jpg,False,1302097,动作 冒险 奇幻 家庭 爱情,美国,诸神之战,https://movie.douban.com/subject/1302097/,1981-10-01,17,1060,6.6,哈利·哈姆林 劳伦斯·奥利弗 克莱尔·布鲁姆 玛吉·史密斯 乌苏拉·安德丝 杰克·格威利姆 苏珊·弗利特伍德 帕特·罗奇 朱迪·鲍克尔 简·菲利普斯 弗劳拉·罗博森 蒂姆·皮戈特-史密斯 布吉斯·梅迪斯 尼尔·麦卡锡 Anna Manahan 弗里达·杰克逊 唐纳德·休斯敦,False
6.6 35,2441,https://img9.doubanio.com/view/photo/s_ratio_poster/public/p838869334.jpg,False,1296024,喜剧 爱情,美国,天算不如人算,https://movie.douban.com/subject/1296024/,2002-04-26,5,1030,6.6,安吉丽娜·朱莉 爱德华·伯恩斯 托尼·夏尔赫布 Peter Epstein 彼特·科拉米斯,False
6.6 35,2442,https://img1.doubanio.com/view/photo/s_ratio_poster/public/p751310089.jpg,False,2027953,剧情 爱情,美国,幸福的黄手帕(美版),https://movie.douban.com/subject/2027953/,2008-01-18,14,1028,6.6,威廉·赫特 玛丽亚·贝罗 克里斯汀·斯图尔特 埃迪·雷德梅恩 桃井薰 格罗弗·库尔森 露西·浮士德 道格拉斯·M·格里芬 Ashlynn Ross 坦纳·吉尔 埃里克·F·亚当斯 约书亚·戴维斯 Chris J. Fanguy R.O. Mackey,False
6.6 35,2443,https://img1.doubanio.com/view/photo/s_ratio_poster/public/p1194926989.jpg,False,4842404,剧情 爱情,英国 澳大利亚,火人,https://movie.douban.com/subject/4842404/,2011,14,1025,6.6,马修·古迪 瑞切尔·格里菲斯 埃茜·戴维斯 凯瑞·福克斯 凯特·宾汉 吉娅·卡迪斯 斯蒂芬·皮科克 凯瑟琳•贝克 博亚娜·诺瓦科维奇 伊丽莎白·布莱克摩尔 劳拉·布伦特 罗宾·马尔科姆 安东尼·海斯 阿林·苏马瓦塔,False
6.6 35,2444,https://img3.doubanio.com/view/photo/s_ratio_poster/public/p2336736673.jpg,True,1306346,冒险 剧情 爱情 战争,中国大陆 美国,庭院里的女人,https://movie.douban.com/subject/1306346/,2001-05-04,10,1020,6.6,威廉·达福 罗燕 石修 刘春霖 约翰·赵 艾米·希尔 凯特·麦克格雷格-斯图尔特 丁一  陈述 潘恒生,False
6.5 35,2445,https://img3.doubanio.com/view/photo/s_ratio_poster/public/p725272302.jpg,True,4271894,喜剧 爱情,中国大陆,非诚勿扰2,https://movie.douban.com/subject/4271894/,2010-12-22,22,284658,6.5,葛优 舒淇 孙红雷 姚晨 安以轩 邵兵 廖凡 邬逸聪 关晓彤 窦文涛 赵宝刚 乐嘉 张馨予 王希维 李晨 马佳玛尧 张涵予 冯绍峰 金美辛 王馨漪 邹晶晶 杨玏,False
6.5 35,2446,https://img1.doubanio.com/view/photo/s_ratio_poster/public/p1382183308.jpg,True,4913200,剧情 喜剧 爱情 奇幻,中国大陆 中国香港,大魔术师,https://movie.douban.com/subject/4913200/,2012-01-12,36,148806,6.5,梁朝伟 刘青云 周迅 闫妮 吴刚 方中信 秦沛 林雪 泽田谦也 王子文 王紫逸 吴彦祖 徐克 戎祥 陆剑明 江道海 谷德昭 吴廷烨 郭佳伊 汪汐潮 马京京 周恩恩 张艺泷 胡宁林 湛雅书 屈菁菁 赵毅 王胜凯 张优 谭建昌 刘頔 王棋 尚国伟 王馨漪 许绍洋 夏德俊,False
6.5 35,2447,https://img1.doubanio.com/view/photo/s_ratio_poster/public/p2208681237.jpg,True,25700838,剧情 爱情 情色,韩国,人间中毒,https://movie.douban.com/subject/25700838/,2014-05-14,15,55309,6.5,宋承宪 林智妍 赵汝贞 温宙完 柳海真 全慧珍 郑元中 金惠娜 裴晟祐 严泰九 韩夏柔 姜德宗 延济旭 文在元 尹多景,False
6.5 35,2448,https://img3.doubanio.com/view/photo/s_ratio_poster/public/p2548038781.jpg,True,1306541,动作 爱情 喜剧,中国香港 中国台湾,玻璃樽,https://movie.douban.com/subject/1306541/,1999-02-06,35,49809,6.5,成龙 舒淇 梁朝伟 周华健 任贤齐 陈松勇 金燕玲 刘以达 吴君如 李灿森 周星驰 田启文 刘一飞 罗家英 段伟伦 麦伟章 苏慧敏 张小蕙 王合喜 森美 卢惠光 吴彦祖 谷德昭 吴辰君 冯德伦 葛民辉 谷祖琳 苏志威 张达明 李力持 阮小仪 张可颐 布拉德利·詹姆斯·艾伦 雷颂德 樋口明日嘉,False
6.5 35,2449,https://img1.doubanio.com/view/photo/s_ratio_poster/public/p2464315908.jpg,True,26857793,爱情,中国香港 中国大陆,原谅他77次,https://movie.douban.com/subject/26857793/,2017-06-23,22,46446,6.5,蔡卓妍 周柏豪  卫诗雅 钟欣潼 卢巧音 郑希怡 雷琛瑜 郑诗君 陆永 林盛斌 小肥 惠英红 吴镇宇 郑丹瑞 李蕙敏 泰臣 孙佳君 韦罗莎 黄秋生 于洋 莫小彤 方志驹,False
6.5 35,2450,https://img3.doubanio.com/view/photo/s_ratio_poster/public/p799723773.jpg,True,4271832,喜剧 爱情,中国香港 中国大陆,完美嫁衣,https://movie.douban.com/subject/4271832/,2010-10-22,13,40429,6.5,杨千嬅 林峯 葛民辉 毛舜筠 廖碧儿 徐子珊 朱璇 周秀娜 敖嘉年 刘以达 吴耀汉 麦玲玲 汤怡,False
6.5 35,2451,https://img1.doubanio.com/view/photo/s_ratio_poster/public/p1896346879.jpg,True,10788846,喜剧 爱情,中国香港,我老公不靠谱,https://movie.douban.com/subject/10788846/,2012-12-07,17,40260,6.5,蔡卓妍 郑伊健 张歆艺 徐正溪 王祖蓝 郑欣宜 关楚耀 郭慧 袁富华 张昱 曾国祥 黎泽恩 文凯玲 贾晓晨 陈沛妍 徐佳琦 林珊珊,False
6.5 35,2452,https://img1.doubanio.com/view/photo/s_ratio_poster/public/p954766619.jpg,True,1300246,喜剧 爱情,中国香港,我老婆未满十八岁,https://movie.douban.com/subject/1300246/,2002-09-25,11,31931,6.5,郑伊健 蔡卓妍 车婉婉 廖碧儿 邓健泓 郑中基 吴耀汉 雷凯欣 钱似莺 林珊珊 赵月明,False
6.5 35,2453,https://img1.doubanio.com/view/photo/s_ratio_poster/public/p2255616708.jpg,True,1299649,剧情 喜剧 爱情,中国香港,下一站…天后,https://movie.douban.com/subject/1299649/,2003-03-13,9,29322,6.5,蔡卓妍 陈小春 余文乐 周励淇 韩君婷 林雪 茜利妹 利沙华 黄伟文,False
6.5 35,2454,https://img1.doubanio.com/view/photo/s_ratio_poster/public/p2207181518.jpg,False,1532205,剧情 爱情 情色,加拿大,与我同眠,https://movie.douban.com/subject/1532205/,2005-09-10,8,26581,6.5,劳伦·李·史密斯 艾里克·巴弗尔 波莉·香农 梅寇·阮 Michael Facciolo 克里斯汀·莱曼 Don Francks Frank Chiesurin,False
6.5 35,2455,https://img3.doubanio.com/view/photo/s_ratio_poster/public/p1072795223.jpg,True,1950198,喜剧 爱情,美国,一夜大肚,https://movie.douban.com/subject/1950198/,2007-06-01,46,24750,6.5,凯瑟琳·海格尔 塞斯·罗根 保罗·路德 乔纳·希尔 莱斯利·曼恩 克里斯汀·韦格 尼克·图恩 Andrew Gonzales Kathy Gonzales Aidan Gonzales Julia Melim 戴克斯·夏普德 Shawn McDaniel 史蒂夫·卡瑞尔 丘增 塔米·赛格 郑肯 艾丽斯·阿帕图  杰西卡·阿尔芭 瑞安·西克莱斯特 伊娃·门德斯 安迪·迪克 保罗·费格 格雷格·布朗 B·J·诺瓦克 马丁·斯塔尔 比尔·哈德尔 查琳·易 杰森·席格尔 乔安娜·科恩斯 亚当·斯科特 杰伊·巴鲁切尔 布兰娜·布朗 艾伦·图代克 斯托米·丹尼尔斯 诺卡·托恩 克雷格·罗宾森 凯瑟琳·瑞特曼 Matt McKane 韦恩·费德曼 史蒂文·布里尔 莫·柯林斯 蒂姆·巴格莱 J·P·马诺克斯 卢顿·万恩怀特三世 哈罗德·雷米斯,False
6.5 35,2456,https://img9.doubanio.com/view/photo/s_ratio_poster/public/p2358120196.jpg,True,1303674,喜剧 剧情 爱情,中国香港,干柴烈火,https://movie.douban.com/subject/1303674/,2002-04-19,13,22503,6.5,古天乐 杨千嬅 陈慧珊 黄伟文 罗莽 卢淑仪 苑琼丹 张达明 李耀明 郑保瑞 张学润 曾雪华 邹凯光,False
6.5 35,2457,https://img9.doubanio.com/view/photo/s_ratio_poster/public/p2239732345.jpg,False,26311828,喜剧 爱情,日本,女主角失格,https://movie.douban.com/subject/26311828/,2015-09-19,16,21014,6.5,桐谷美玲 山崎贤人 坂口健太郎 福田彩乃 我妻三轮子 高桥玛莉润 滨田麻里 竹内力 中尾彬 六角精儿 柳泽慎吾 今野浩喜 中川翼 大智 比嘉梨乃 增田有华,False
6.5 35,2458,https://img3.doubanio.com/view/photo/s_ratio_poster/public/p2387629952.jpg,True,1875313,剧情 爱情,中国大陆,梦想照进现实,https://movie.douban.com/subject/1875313/,2006-06-30,3,17191,6.5,徐静蕾 韩童生 贺鹏,False
6.5 35,2459,https://img3.doubanio.com/view/photo/s_ratio_poster/public/p613595811.jpg,True,1853752,剧情 喜剧 爱情,韩国,机器人之恋,https://movie.douban.com/subject/1853752/,2006-12-07,8,17109,6.5,郑智薰 林秀晶 李龙女 柳好贞 金秉玉 吴达洙 朴秉恩 孙荣顺,False
6.5 35,2460,https://img9.doubanio.com/view/photo/s_ratio_poster/public/p2543670474.jpg,False,30209802,剧情 爱情,美国,之后,https://movie.douban.com/subject/30209802/,2019-04-12,16,17031,6.5,约瑟芬·兰福德 赫洛·费因斯-提芬 彼得·盖勒 詹妮弗·比尔斯 塞尔玛·布莱尔 梅多·威廉姆斯 迪伦·阿诺德 塞缪尔·拉森 伊南娜·萨尔基斯 何塞·阿尔弗雷多·费尔南德斯 皮亚·米尔 沙恩·保罗·麦吉 斯温·特梅尔 哈迪扎·里德·桑德尔 马克·克斯洛威茨 艾米丽塔·T·冈萨雷斯,False
6.5 35,2461,https://img3.doubanio.com/view/photo/s_ratio_poster/public/p1600831532.jpg,True,1457191,剧情 爱情,美国,分手男女,https://movie.douban.com/subject/1457191/,2006-06-02,49,16697,6.5,文斯·沃恩 詹妮弗·安妮斯顿 乔伊·劳伦·亚当斯 科尔·豪瑟 乔恩·费儒 杰森·贝特曼 Rahul Thakkar John R. Haley Jessica Stramer Katherine M. O'Connor Matt Dworzanczyk John Gearries Holly Barrett Lisa Pace William Nero Jr. Kelly Nienaltowski 玛丽-帕特·格林 Andrew Irvin 简·奥德曼 Alexandra Dinovi Jamie Julia Parker Lauren Cokeley Ian Kalanges Luke Schneider Jason Abustan Donier Tyler 扎克·沙达 吉欧夫·斯图兹 贾斯汀·朗 Michael Cook 文森特·多诺费奥 约翰·迈克尔·辛吉斯 James Azrael 基尔·奥唐纳 伊凡·谢尔盖 朱迪·戴维斯 Alex Bickle Anna Ingenthron Jonathan Samuels Ron Valdez 梅赛德丝·马索霍 Rhett Miller Alexandra LoRusso 迈克尔·斯泰利 Chris Papadopoulos Linda Cohn 安-玛格丽特 凯蒂·克里瑞 彼得·比灵斯雷,False
