rating,rank,cover_url,is_playable,id,types,regions,title,url,release_date,actor_count,vote_count,score,actors,is_watched
7.7 40,463,https://img3.doubanio.com/view/photo/s_ratio_poster/public/p726824081.jpg,True,1300916,动作 科幻 冒险,美国 英国 加拿大 瑞士,超人,https://movie.douban.com/subject/1300916/,1978-12-10,47,18906,7.7,克里斯托弗·里夫 马龙·白兰度 吉恩·哈克曼 尼德·巴蒂 杰基·库珀 格伦·福特 特瑞沃·霍华德 玛戈·基德 杰克·奥哈罗兰 瓦莱丽·佩莱恩 玛丽亚·雪儿 特伦斯·斯坦普 菲莉丝·德丝达 苏珊娜·约克 杰夫·伊斯特 马克·麦克卢尔 莎拉·道格拉斯 罗伯特·亨德森 阿兰·提尔文 理查德·唐纳 拉里·哈格曼 柯克·阿林 约翰·拉岑贝格 大卫·尼尔 约翰·斯图尔特 大卫·卡尔德 罗伊史蒂文 Antony Scott Mark Wynter 拉里·兰布 布鲁斯·博阿 菲尔·布朗 威廉·拉塞尔 George Harris II 约翰·霍林斯 Lise Hilboldt 雷克斯·埃弗哈特 哈里·弗雷德尔 哈里·安德鲁斯 雷克斯·里德 Tony Selby Lee Quigley Bo Rucker Sue Shifrin 布莱恩·普罗瑟罗 诺尔·妮尔 迈克尔·英塞恩,False
7.7 40,464,https://img9.doubanio.com/view/photo/s_ratio_poster/public/p1198261784.jpg,True,1295490,动作 喜剧 家庭,美国,捕鼠记,https://movie.douban.com/subject/1295490/,1997-12-19,5,18686,7.7,内森·连恩 李·伊万斯 薇姬·刘易斯 莫里·柴金 克里斯托弗·沃肯,False
7.7 40,465,https://img9.doubanio.com/view/photo/s_ratio_poster/public/p486302575.jpg,False,4300640,剧情 喜剧 动作,韩国,奶奶强盗团,https://movie.douban.com/subject/4300640/,2010-03-18,17,18370,7.7,金惠玉 罗文姬 金秀美 任昌丁 金炳哲 姜京宪 权五镇 孙光业 Kwang-eop Son 车雅伦 裴晟祐 金熙元 李恩宇 金光奎 罗美兰 刘荷娜 廉东铉,False
7.7 40,466,https://img1.doubanio.com/view/photo/s_ratio_poster/public/p2136952828.jpg,True,1302176,动作 喜剧 犯罪 爱情,美国,白头神探,https://movie.douban.com/subject/1302176/,1988-12-02,36,18097,7.7,莱斯利·尼尔森 普瑞希拉·普雷斯利 里卡多·蒙特尔班 乔治·肯尼迪 O·J·辛普森 苏珊·博宾 南希·马钱德 查尔斯·格拉迪 布琳克·史蒂文斯 约翰·豪斯曼 康拉德·E·帕尔米萨诺 劳伦斯·蒂尔尼 Mel Allen 阿尔·杨科维克 Reggie Jackson Robert K. Weiss Rick Seaman Joe West 吉姆·帕尔默 Stuart Lancaster Curt Gowdy 乔·格里法西 迪克·英伯格 Tony Brafa Jeannette Charles 乔茜·布拉勒斯 雷耶·比克 Jay Johnstone Nicholas Worth Burton Zucker 夏洛特扎克 Sydney Urshan Dick Vitale Hank Robinson Tim McCarver Prince Hughes,False
7.7 40,467,https://img3.doubanio.com/view/photo/s_ratio_poster/public/p734522641.jpg,False,1483239,剧情 动作 犯罪 惊悚,美国 德国,夺命枪火,https://movie.douban.com/subject/1483239/,2006-02-24,22,17963,7.7,保罗·沃克 卡梅隆·布莱特 维拉·法米加 查兹·帕尔明特瑞 卡瑞尔·罗登 约翰尼·梅辛纳 伊万娜·米利塞维奇 艾历克斯·纽伯格 迈克尔·库立兹 布鲁斯·奥尔特曼 伊丽莎白·米切尔 阿瑟·J·纳斯加勒拉 约翰·诺贝尔 伊达莉丝·德莱昂 大卫·沃肖夫斯基 Maurice Lee 小托马斯·罗萨莱斯 Howie Lotker Todd Kramer 布莱恩·卡斯佩 Jeff Caster 奥克利·莱曼,False
7.7 40,468,https://img1.doubanio.com/view/photo/s_ratio_poster/public/p991080197.jpg,False,1308379,动作 奇幻,日本,阴阳师2,https://movie.douban.com/subject/1308379/,2003-10-04,12,15434,7.7,野村万斋 深田恭子 中井贵一 伊藤英明 市原隼人 能世安奈 伊武雅刀 今井绘理子 八卷建志 铃木弘满 古手川祐子 山田辰夫,False
7.7 40,469,https://img9.doubanio.com/view/photo/s_ratio_poster/public/p2531057405.jpg,False,30300277,动作 历史 战争,俄罗斯,T-34坦克,https://movie.douban.com/subject/30300277/,2018-12-27,13,15426,7.7,亚历山大·佩特罗夫 文森兹·凯弗 维克多·多勃朗拉沃夫 伊琳娜·斯达申鲍姆 西蒙·特列斯库诺夫 尤里·鲍里索夫 阿尔焦姆·贝斯特罗夫 约书亚·格罗斯 伊格·克里普诺夫 彼得·斯科沃尔佐夫 阿列克西·乌沙科夫 沃尔夫冈·塞尔尼 米凯尔·德扎尼比肯,False
7.7 40,470,https://img3.doubanio.com/view/photo/s_ratio_poster/public/p656541463.jpg,True,3726986,动作 古装,日本 英国,十三刺客,https://movie.douban.com/subject/3726986/,2010-09-25,29,14481,7.7,役所广司 山田孝之 伊势谷友介 泽村一树 古田新太 高冈奏辅 六角精儿 波冈一喜 近藤公园 石垣佑磨 洼田正孝 伊原刚志 松方弘树 吹石一惠 谷村美月 斋藤工 阿部进之介 斋藤步 井上肇 高川裕也 神乐坂惠 内野圣阳 光石研 岸部一德 平干二朗 松本幸四郎 稻垣吾郎 市村正亲 福本清三,False
7.7 40,471,https://img1.doubanio.com/view/photo/s_ratio_poster/public/p2162655199.jpg,True,1293830,动作 冒险 惊悚,美国,猎杀红色十月,https://movie.douban.com/subject/1293830/,1990-03-02,8,13611,7.7,肖恩·康纳利 亚历克·鲍德温 斯科特·格伦 山姆·尼尔 詹姆斯·厄尔·琼斯 皮特·安蒂克 拉里·弗格森 斯特兰·斯卡斯加德,False
7.7 40,472,https://img1.doubanio.com/view/photo/s_ratio_poster/public/p2196649757.jpg,True,1302457,动作 剧情 历史 爱情 战争,印度,阿育王,https://movie.douban.com/subject/1302457/,2001-09-13,10,12977,7.7,沙鲁克·汗 卡琳娜·卡普尔 丹尼·邓宗帕 拉胡尔.戴夫 瑞莎塔·布哈特 Rajlaxmi R. Roy 萨米尔·萨卡尔 吉恩德拉·沙斯特里 乔尼·里沃 阿吉特·库玛尔,False
7.7 40,473,https://img9.doubanio.com/view/photo/s_ratio_poster/public/p453475066.jpg,True,1293316,动作 冒险 科幻 惊悚,美国,星际旅行2：可汗怒吼,https://movie.douban.com/subject/1293316/,1982-06-04,15,10674,7.7,威廉·夏特纳 伦纳德·尼莫伊 德福雷斯特·凯利 詹姆斯·杜汉 沃尔特·凯尼格 武井乔治 尼切尔·尼克斯 比比·贝什 Merritt Butrick 保罗·温菲尔德 柯尔斯蒂·艾利 里卡多·蒙特尔班 艾克·艾森曼 John Vargas John Winston,False
7.7 40,474,https://img9.doubanio.com/view/photo/s_ratio_poster/public/p453476294.jpg,False,1309112,喜剧 动作 动画 冒险,美国 德国,美国战队：世界警察,https://movie.douban.com/subject/1309112/,2004-10-15,9,9987,7.7,崔·帕克 马特·斯通 克里斯汀·米勒 达兰·诺里斯 杰里米·沙达 莫里斯·拉马奇 Elle Russ 菲尔·亨德里 大卫·米驰,False
7.7 40,475,https://img9.doubanio.com/view/photo/s_ratio_poster/public/p1036751766.jpg,True,1305096,动作 喜剧 犯罪,美国,白头神探2½：恐怖的气味,https://movie.douban.com/subject/1305096/,1991-06-28,39,9759,7.7,莱斯利·尼尔森 普瑞希拉·普雷斯利 乔治·肯尼迪 O·J·辛普森 C. Lindsay Workman Burton Zucker 夏洛特扎克 蒂姆·奥康纳 Peter Van Norden John Roarke Margery Ross William Woodson Raynor Scheine Robert K. Weiss Robert Weil 梅尔·托尔梅 理查德·格雷弗斯 莎莎·嘉宝 吉娜·马斯特罗吉科莫 Larry McCormick Claude Jay McLin 罗伯特·顾雷特 阿尔·法恩 彼特·马克·里奇曼 大卫·扎克 阿尔·杨科维克 洛伊德·波奇纳 安东尼·詹姆斯 Colleen Fitzpatrick 克里夫·比米斯 Tom McGreevey Ken Kerman Jennifer Segal Jose Gonzales-Gonzales Ryan Harrison 亚历山大·福克 约翰·弗利克 杰奎琳·布鲁克斯 Nathaniel Bellamy Jr.,False
7.7 40,476,https://img9.doubanio.com/view/photo/s_ratio_poster/public/p454191636.jpg,False,1417073,动画 恐怖 动作,日本,最后的吸血鬼,https://movie.douban.com/subject/1417073/,2000-07-28,8,8896,7.7,工藤夕贵 小家山晃 Joe Romersa Rebecca Forstadt 史蒂夫·布卢姆 汤姆·法汉 戴夫·麦罗 保罗·卡尔,False
7.7 40,477,https://img9.doubanio.com/view/photo/s_ratio_poster/public/p1435506144.jpg,True,3013046,动作 犯罪 惊悚,美国,法国贩毒网,https://movie.douban.com/subject/3013046/,1971-10-09,21,7747,7.7,吉恩·哈克曼 费尔南多·雷伊 罗伊·沙伊德尔 托尼·洛·比安科 查尔斯·麦格雷戈 Frédéric de Pasquale 比尔•希克曼 Burt Richards Robert Weil Fayette Pinkney 桑尼格鲁索 Ann Rebbot 乔·罗·格里普 Harold Gary 阿尔·法恩 弗兰克·阿多尼斯 马塞尔·博祖菲 Sheila Ferguson André Ernotte 萨丽娜·C·格兰特 埃迪·伊根,False
7.7 40,478,https://img1.doubanio.com/view/photo/s_ratio_poster/public/p2204679567.jpg,False,1302441,动作 喜剧 剧情,中国香港,表姐，你好嘢！,https://movie.douban.com/subject/1302441/,1990-06-28,19,6538,7.7,郑裕玲 梁家辉 张坚庭 周文健 何柏光 林映辉 何添 麦伟章 雷达 梁克逊 尹灵光 梁心 林蛟 曹达华 西瓜刨 张锦程 古明华 冯敬文 姚文基,False
7.7 40,479,https://img3.doubanio.com/view/photo/s_ratio_poster/public/p2209381781.jpg,True,1305970,动作 悬疑 科幻 惊悚,美国,星际旅行6：未来之城,https://movie.douban.com/subject/1305970/,1991-12-06,40,5797,7.7,威廉·夏特纳 伦纳德·尼莫伊 德福雷斯特·凯利 詹姆斯·杜汉 沃尔特·凯尼格 武井乔治 金·凯特罗尔 尼切尔·尼克斯 布洛克·皮特斯 柯特伍德·史密斯 Tom Morga Douglas Price 雷内·奥博诺伊斯 克里斯蒂安·史莱特 Judy Levitt 马克·雷纳德 Matthias Hues Doug Engalla 罗莎娜·德索托 Barron Christian Carlos Cestero 迈克尔·博夫舍维尔 约翰·布卢姆 约翰·贝克 Eric A. Stillwell Brett Porter 罗伯特·伊斯顿 里昂·拉瑟姆 伊曼 鲍里斯·李·库尔通格 大卫·沃纳 Todd Bryant Jim Boeke J.D. Walters 格雷斯·李·惠特尼 克里斯托弗·普卢默 约翰·舒克 威廉姆·摩根·谢泼德 迈克尔·多恩 Paul Rossilli,False
7.7 40,480,https://img1.doubanio.com/view/photo/s_ratio_poster/public/p2161798908.jpg,False,20552089,动作 动画 奇幻 冒险,美国,小叮当与海盗仙子,https://movie.douban.com/subject/20552089/,2014-02-14,19,5488,7.7,梅·惠特曼 克里斯蒂娜·亨德里克斯 汤姆·希德勒斯顿 刘玉玲 雷文-西蒙尼 梅根·希尔提 帕梅拉·阿德龙 安吉拉·巴蒂斯 吉姆·卡明斯 卡洛斯·庞丝 米克·温格特 凯文·迈克尔·理查德森 杰夫·贝内特 罗伯·鲍森 格蕾·德丽斯勒 凯瑞·华格伦 简·霍洛克斯 杰西·麦卡尼 安杰丽卡·休斯顿,False
7.7 40,481,https://img1.doubanio.com/view/photo/s_ratio_poster/public/p2367694259.jpg,True,3838283,剧情 动作,中国,火线追凶之绝命狙击,https://movie.douban.com/subject/3838283/,2009-07-09,7,4830,7.7,钟汉良 徐少强 公方敏 涂黎曼 齐芳 释小龙 阿杰,False
7.7 40,482,https://img1.doubanio.com/view/photo/s_ratio_poster/public/p2367693417.jpg,True,3862259,剧情 动作 悬疑,中国,火线追凶之黑枪疑云,https://movie.douban.com/subject/3862259/,2009-07-15,7,4569,7.7,钟汉良 侯江龙 公方敏 涂黎曼 齐芳 释小龙 阿杰,False
7.7 40,483,https://img3.doubanio.com/view/photo/s_ratio_poster/public/p2333895141.jpg,True,1307821,剧情 动作 爱情 古装,中国香港,刺马,https://movie.douban.com/subject/1307821/,1973-02-24,37,4569,7.7,狄龙 姜大卫 陈观泰 井莉 井淼 罗强 何其昌  王光裕 黄梅 陈全 陈强 杨柏尘 刘俊辉 徐松鹤 张石庵 徐发 金军 余袁稳 龙逸升 金天柱 齐琳 顧占熊 谭宝 郑康业 田青 李修贤 江岛 王清河 樊梅生 杨泽霖 王将 陈国权 何柏光 郑雷 袁信义 刘家荣 沈劳,False
7.7 40,484,https://img3.doubanio.com/view/photo/s_ratio_poster/public/p453719810.jpg,False,1966050,剧情 动作 惊悚 战争,美国,24小时：救赎,https://movie.douban.com/subject/1966050/,2008-11-23,19,4550,7.7,基弗·萨瑟兰 切莉·琼斯 鲍勃·冈顿 科鲁姆·费奥瑞 鲍沃斯·布斯 罗伯特·卡莱尔 强·沃特 彼特·麦尼科 吉尔·贝罗斯 哈基姆·凯-卡西姆 马克·基利 伊萨赫·德·班克尔 Gregory George Frank 肖恩·卡梅伦·迈克尔 塞巴斯蒂安·罗奇 托尼·托德 卡莉·波普 克里斯·勒姆彻 埃里克·里夫利,False
7.7 40,485,https://img1.doubanio.com/view/photo/s_ratio_poster/public/p2367694349.jpg,True,3862261,剧情 动作,中国大陆,火线追凶之突然死亡,https://movie.douban.com/subject/3862261/,2008,8,4243,7.7,钟汉良 傅隽 公方敏 涂黎曼 齐芳 寇占文 释小龙 阿杰,False
7.7 40,486,https://img9.doubanio.com/view/photo/s_ratio_poster/public/p1341966214.jpg,True,1293045,动作 犯罪 惊悚,美国,肮脏的哈里,https://movie.douban.com/subject/1293045/,1971-12-22,7,4169,7.7,克林特·伊斯特伍德 哈里·古蒂诺 雷尼·桑托尼 约翰·沃侬 安德鲁·罗宾逊 Joe Finnegan 唐·希格尔,False
7.7 40,487,https://img9.doubanio.com/view/photo/s_ratio_poster/public/p2205469914.jpg,False,1440347,动作 剧情 惊悚,日本,修罗雪姬,https://movie.douban.com/subject/1440347/,1973-12-01,17,4105,7.7,梶芽衣子 黑泽年男 赤座美代子 冈田英次 广濑正一 小松方正 西村晃 大门正明 中田喜子 阿藤快 地井武男 仲谷升 长谷川弘 中原早苗 小野武彦 高木均 根岸明美,False
7.7 40,488,https://img9.doubanio.com/view/photo/s_ratio_poster/public/p2233634016.jpg,True,1307605,剧情 动作 古装,中国香港,五毒,https://movie.douban.com/subject/1307605/,1978-08-12,24,3465,7.7,孙建 江生 罗莽 鹿峰 葛萍 方茹 黄公武 冯明 刘晃世  刘准 王憾尘 黎友兴 金天柱 谭镇渡 余太平 王龙威 郭追 谷峰 王清河 沈劳 韦白 孙树培 钱似莺 吕红,False
7.7 40,489,https://img9.doubanio.com/view/photo/s_ratio_poster/public/p1693074036.jpg,True,1307115,剧情 动作 武侠 古装,中国香港,楚留香,https://movie.douban.com/subject/1307115/,1977-05-03,45,3331,7.7,狄龙 岳华 苗可秀 凌云 李菁 伍元勋 山怪 曾楚霖 徐发 艾飞 钱似莺 梁尚云 黄志强 闵敏 张照 吴杭生 强汉 张作舟 王憾尘 张石庵 金军 顧占熊 江全 陈国权 元奎 顾冠忠 卢苇 刘慧玲 田青 井淼 詹森 夏萍 李寿祺 顾文宗 徐少强 燕南希 庄莉 陈思佳 贝蒂 袁祥仁 沈劳 王清河 杨志卿 谷峰 元华,False
7.7 40,490,https://img1.doubanio.com/view/photo/s_ratio_poster/public/p2537595119.jpg,True,1916282,动作 战争,中国大陆,林海雪原,https://movie.douban.com/subject/1916282/,1960,18,2736,7.7,张勇手 王润身 梁志鹏 崔荣久 张良 师伟 王毅 王连海 张驰 曲云 刘季云 杨成轩 孟庆芳 里坡 张怀志 毕钰 李力 马晨曦,False
7.7 40,491,https://img9.doubanio.com/view/photo/s_ratio_poster/public/p2456454004.jpg,False,1422883,犯罪 动作 喜剧,日本,跳跃大搜查线2：封锁彩虹桥,https://movie.douban.com/subject/1422883/,2003-07-19,23,2573,7.7,织田裕二 深津绘里 水野美纪 中山裕介 小野武彦 佐户井贤太 冈村隆史 入江雅人 池田成志 中原丈雄 小林进 真矢美纪 向井地美音 畠山明子 小泉孝太郎 神木隆之介 柳叶敏郎 小松彩夏 文森特·吉里 小木茂光 碇矢长介 北村总一朗 广泽草,False
7.7 40,492,https://img9.doubanio.com/view/photo/s_ratio_poster/public/p1407499775.jpg,True,1871997,喜剧 动作 武侠 古装,中国香港,猫头鹰,https://movie.douban.com/subject/1871997/,1981-04-30,21,2478,7.7,姜大卫 曾志伟 秦沛 徐少强 仓田保昭 黄韵诗 卫子云 矮子王 欧阳玲珑 张帝 赵雷 尔冬升 葛小宝 李昆 卢迪 江岛 陈星 卢苇 李影 王侠 梁尚云,False
7.7 40,493,https://img1.doubanio.com/view/photo/s_ratio_poster/public/p2288982229.jpg,False,1401265,动作 犯罪 惊悚,中国香港,第一类型危险,https://movie.douban.com/subject/1401265/,1980-12-04,19,2434,7.7,罗烈 林珍奇 龙天生 胡大为 车保罗 吕良伟 区瑞强 岑建勋 于仁泰 梁珍妮 叶德娴 张永雄 刘允 冯润泉 梁普智 冼杞然 刘成汉 章国明 侯思杰,False
7.7 40,494,https://img1.doubanio.com/view/photo/s_ratio_poster/public/p2541617008.jpg,True,1444533,动作 冒险 剧情,意大利 法国,基督山伯爵,https://movie.douban.com/subject/1444533/,1961-12-06,21,2420,7.7,路易斯·乔丹 伊冯·弗奴克丝 皮埃尔·蒙迪 伯纳德·德兰 佛朗哥·席尔瓦 克劳丁·科斯特 让-克劳德·米歇尔 玛丽·莫吉 让·马丁内利 亨利·吉索尔 罗尔达诺·卢皮 亨利·维尔伯特 让-雅克·德尔伯 保罗·阿米奥 亨利·阿里乌斯 安德烈·达利贝尔 雅克·迪南 乔治斯·拉内 Marthe Marty 李梓 伊夫·雷尼尔,False
7.7 40,495,https://img3.doubanio.com/view/photo/s_ratio_poster/public/p1259617471.jpg,True,1305869,喜剧 动作 犯罪,英国,意大利任务,https://movie.douban.com/subject/1305869/,1969-06-05,26,2168,7.7,迈克尔·凯恩 诺埃尔·考沃德 班尼·黑尔 雷夫·瓦朗 托尼·贝克利 罗萨诺·布拉齐 玛格丽特·布赖 艾琳·汉铎 约翰·勒·梅苏里尔 Fred Emney 约翰·克莱夫 Graham Payn Michael Standing 哈里·贝尔德 乔治·因斯 罗伯特·鲍威尔 Mario Valgoi 罗伯特·里耶蒂 蒂莫西·贝特森 大卫·凯利 阿诺德·戴蒙德 Simon Dee 莱丽亚·古多尼 Frank Kelly 瓦莱丽·莱昂 Henry McGee,False
7.7 40,496,https://img9.doubanio.com/view/photo/s_ratio_poster/public/p2255620495.jpg,True,1305042,动作 剧情,中国香港,大决斗,https://movie.douban.com/subject/1305042/,1971-04-21,46,2109,7.7,姜大卫 狄龙 谷峰 张石庵 金军 李钊 张志平 尹灵光 何柏光 赵雄 王青 杨柏尘 黎恩 黄梅 卢慧 罗强 刘俊辉 徐发 伍元勋 陈绍佳 龙逸升 邓祥 王光裕 戚毅雄 蓝伟烈  李允中 王清河 郑康业 杨志卿 陈星 Ping Wang 陈观泰 潘爱伦 洪流 虞慧 卢苇 谭宝 黄哈 谈瑛 曾楚霖 徐虾 冯克安 黄培基 郑雷 汪萍 王钟,False
7.7 40,497,https://img9.doubanio.com/view/photo/s_ratio_poster/public/p1412215124.jpg,True,1303587,动作 爱情 悬疑 武侠 古装,中国香港,保镖,https://movie.douban.com/subject/1303587/,1969-12-28,36,2052,7.7,姜大卫 狄龙 李菁 井淼 谷峰 龙逸升 杨柏尘 黄梅 卢慧 黄培基 罗强 张志平 刘俊辉 徐松鹤 尹灵光 顧占熊 王光裕 徐发 伍元勋 陈绍佳 戚毅雄 谭宝 王清河 郑康业 陈星 任世官 洪流 山怪 韩国材 曾楚霖 何柏光 陈全 郑雷 袁信义 袁祥仁 王钟,False
7.7 40,498,https://img3.doubanio.com/view/photo/s_ratio_poster/public/p2283624590.jpg,True,1532596,动作 冒险 剧情,中国大陆,嘎达梅林,https://movie.douban.com/subject/1532596/,2002-08-25,4,1719,7.7,涂们 刘小微 鄂布斯 德力格尔,False
7.7 40,499,https://img3.doubanio.com/view/photo/s_ratio_poster/public/p2327425283.jpg,False,1292477,动作 犯罪 动画 悬疑,美国,蝙蝠侠大战幻影人,https://movie.douban.com/subject/1292477/,1993-12-25,4,1381,7.7,凯文·康瑞 达娜·德拉尼 哈特·巴克纳 马克·哈米尔,False
7.7 40,500,https://img9.doubanio.com/view/photo/s_ratio_poster/public/p2498073546.jpg,False,1304756,动作 剧情 历史 战争,英国,击沉俾斯麦号！,https://movie.douban.com/subject/1304756/,1960-02-11,46,1219,7.7,肯尼思·莫尔 达娜·温特 卡尔·蒙纳 劳伦斯·奈史密斯 格佛雷·肯   Ronald Leigh-Hunt Harry Locke 维克多·麦德瑞 埃斯蒙德·奈特 Ronald Hines 迈克尔·霍登 山姆·基德 Russell Napier 迈克尔·里佩尔 爱德华 R·莫罗 布莱恩·沃思 Jack Watling 西德尼·塔夫勒 Graham Stark Karel Stepanek 约翰·斯特赖德 Frederick Schiller John G. Heller 格林·休斯顿 迈克尔·古德利菲 西恩·布瑞特 诺曼·威兹德姆 唐纳德·丘吉尔 戴维·海明斯 瓦尔特·胡德 爱德华·贾德 迈克尔·萨恩 伊恩·亨德里 杰克·格威利姆 Victor Beaumont 沃尔特·戈塔尔 莫瑞斯·德纳姆 马克·迪格纳姆 欧内斯特·克拉克 罗伊·卡斯尔 Brandon Brady Johnny Briggs Peter Burton 迈克尔·巴尔弗 约翰·巴伦 约翰·斯图尔特,False
7.7 40,501,https://img3.doubanio.com/view/photo/s_ratio_poster/public/p1923752621.jpg,False,1779098,动作 喜剧 剧情 爱情,日本,无敌青春,https://movie.douban.com/subject/1779098/,2004-10-11,15,1185,7.7,盐谷瞬 泽尻英龙华 加濑亮 小田切让 波冈一喜 桐谷健太 余贵美子 木村绿子 尾上宽之 真木阳子 光石研 小出惠介 松永京子 江口德子 高冈奏辅,False
7.7 40,502,https://img1.doubanio.com/view/photo/s_ratio_poster/public/p2181099378.jpg,True,1780342,喜剧 动作 冒险 家庭,苏联,运虎记,https://movie.douban.com/subject/1780342/,1961-09-08,14,1004,7.7,阿列克谢·格里波夫 伊万·德米特里耶夫 玛格丽塔·娜扎罗娃 尼古拉·沃尔科夫 Aleksei Kozhevnikov 叶甫盖尼·列昂诺夫 阿尔卡季·特鲁索夫 阿列克谢·斯米尔诺夫 尼古拉·特罗菲莫夫 阿丽萨·弗雷因德利赫 Aleksandr Benyaminov Vladimir Belokurov 瓦西里·兰诺沃依 Aleksandr Susnin,False
7.6 40,503,https://img1.doubanio.com/view/photo/s_ratio_poster/public/p2541280047.jpg,True,3878007,动作 奇幻 冒险,美国 澳大利亚,海王,https://movie.douban.com/subject/3878007/,2018-12-07,48,730306,7.6,杰森·莫玛 艾梅柏·希尔德 威廉·达福 帕特里克·威尔森 妮可·基德曼 杜夫·龙格尔 叶海亚·阿卜杜勒-迈丁 特穆拉·莫里森 林路迪 迈克尔·比奇 兰道尔·朴 格拉汉姆·麦克泰维什 雷·沃纳尔 泰努伊·柯克伍德 塔穆尔·柯克伍德 丹泽尔·夸克 卡恩·古尔杜尔 奥蒂斯·丹吉 克考亚·克库毛诺 朱莉·安德鲁斯 约翰·瑞斯-戴维斯 杰曼·翰苏 索菲亚·福雷斯特 娜塔莉·萨福兰 杰克·安德鲁 汉克·阿莫斯 帕特里克·考克斯 罗伯特·朗斯特里特 德维卡·帕利赫 梅布尔·塔莫内 文森特·B·拉戈斯 加布里埃拉·佩特科娃 爱丽丝·兰斯伯里 帕特里克·艾奇逊 约翰·盖蒂尔 塔丽亚·杰德·霍尔特 罗斯·克纳汉 布拉登·刘易斯 萨尔瓦多·梅伦达 山姆·莫纳汉 温妮·穆赞贝 凯·潘塔诺 安娜·帕奇 乔恩·奎斯蒂德 迪伦·斯图默 米奇·武尔夫 阿明·阿卜杜勒·奎德 彼得·阿佩塞拉,False
7.6 40,504,https://img9.doubanio.com/view/photo/s_ratio_poster/public/p2302930556.jpg,True,26311973,喜剧 动作 悬疑,中国大陆,唐人街探案,https://movie.douban.com/subject/26311973/,2015-12-31,19,573176,7.6,王宝强 刘昊然 佟丽娅 陈赫 肖央 小沈阳 潘粤明 马浴柯 张子枫 赵英俊 桑平 金士杰 大鹏 张国强 李叶青 陈祉希 潘斌龙 李高吉 张大大,False
7.6 40,505,https://img3.doubanio.com/view/photo/s_ratio_poster/public/p2388501883.jpg,True,3025375,动作 奇幻 冒险,美国,奇异博士,https://movie.douban.com/subject/3025375/,2016-11-04,20,468493,7.6,本尼迪克特·康伯巴奇 蒂尔达·斯文顿 麦斯·米科尔森 切瓦特·埃加福 瑞秋·麦克亚当斯 迈克尔·斯图巴 本尼迪克特·王 本杰明·布拉特 斯科特·阿金斯 莎拉·费希恩 阿拉·萨菲 斯坦·李 安蒂·哈卡拉 寇布勒·霍尔德布鲁克-史密斯 Nan Li 克里斯·海姆斯沃斯 卡特莉娜德登 梅拉·沙尔 艾米·兰德克 李楠,False
7.6 40,506,https://img3.doubanio.com/view/photo/s_ratio_poster/public/p2043625972.jpg,True,5323968,动作 科幻 冒险,美国,环太平洋,https://movie.douban.com/subject/5323968/,2013-07-31,28,370234,7.6,查理·汉纳姆 菊地凛子 伊德里斯·艾尔巴 查理·戴 朗·普尔曼 罗伯特·卡辛斯基 马克斯·马蒂尼 伯恩·戈曼 小克利夫顿·克林斯 芦田爱菜 迪亚哥·克莱特霍夫 希瑟·多克森 罗伯特·梅耶 刘智福 刘智满 刘智堂 罗宾·托马斯 塞巴斯蒂安·皮戈特 罗伯特·莫尔斯 林原惠美 金永钢 克拉拉·王 津成雨 德里克·赫德 圣地亚哥·塞古拉 拉里·乔·坎贝尔 布拉德·威廉姆·亨克 路知行,False
7.6 40,507,https://img3.doubanio.com/view/photo/s_ratio_poster/public/p451885601.jpg,True,3066739,动作 冒险 科幻,美国,钢铁侠2,https://movie.douban.com/subject/3066739/,2010-05-07,28,337001,7.6,小罗伯特·唐尼 格温妮斯·帕特洛 米基·洛克 斯嘉丽·约翰逊 山姆·洛克威尔 唐·钱德尔 塞缪尔·杰克逊 乔恩·费儒 保罗·贝坦尼 克拉克·格雷格 凯特·玛拉 约翰·斯拉特里 斯坦·李 海伦娜·马特森 莱丝莉·比伯 伊隆·马斯克 蒂姆·金尼 盖瑞·山德林 德尼兹·恰克尔 比尔·奥雷利 陆建艺 叶夫盖尼·拉扎列夫 克里斯汀·阿曼普 亚当·高德斯坦 拉里·埃里森 菲利普·贝格龙 奥立薇娅·玛恩 基思·米德尔布鲁克,False
7.6 40,508,https://img3.doubanio.com/view/photo/s_ratio_poster/public/p2194066391.jpg,True,24745500,剧情 动作 武侠 古装,中国大陆,绣春刀,https://movie.douban.com/subject/24745500/,2014-08-07,16,334870,7.6,张震 刘诗诗 王千源 李东学 聂远 金士杰 叶青 周一围 朱丹 赵立新 叶项明 乔磊 黄皓达 杨轶 杨晓波 古典,False
7.6 40,509,https://img9.doubanio.com/view/photo/s_ratio_poster/public/p1078047854.jpg,True,2998270,动作 犯罪 悬疑,美国 德国,大侦探福尔摩斯,https://movie.douban.com/subject/2998270/,2010-02-25,17,259234,7.6,小罗伯特·唐尼 裘德·洛 瑞秋·麦克亚当斯 马克·斯特朗 凯利·蕾莉 威廉·霍普 克里夫·罗素 James A. Stephens 杰佛逊·豪尔 詹姆斯·福克斯 威廉·休斯顿 彼得·迈尔斯 埃迪·马森 布罗娜·加拉赫 汉斯·麦瑟逊 罗伯特·梅耶 杰拉丁妮·詹姆斯,False
