rating,rank,cover_url,is_playable,id,types,regions,title,url,release_date,actor_count,vote_count,score,actors,is_watched
7.6 40,510,https://img1.doubanio.com/view/photo/s_ratio_poster/public/p1731774258.jpg,True,3642835,动作 喜剧 科幻,美国,黑衣人3,https://movie.douban.com/subject/3642835/,2012-05-25,32,243061,7.6,威尔·史密斯 汤米·李·琼斯 乔什·布洛林 杰梅奈·克莱门特 艾玛·汤普森 尼可·斯彻金格 爱丽丝·伊芙 大卫·拉斯彻 比尔·哈德尔 迈克尔·斯图巴 Tom McComas 里克·贝克 约瑟夫·甘纳斯考利 泰勒·约翰斯顿 基内·扬 伊恩·布莱克曼 托拜厄斯·西格尔 乔纳森·德鲁 艾琳·诺伊芙 杰克·奥康耐 陆建艺 凯蒂·雷迪捷 蒂姆·波顿 贾斯汀·比伯 雷普·汤恩 米歇尔·罗德里格兹 贝蒂·怀特 迈克·柯尔特 威尔·阿奈特 查理·巴奈特 Valence Thomas 迈克尔·切鲁斯,False
7.6 40,511,https://img9.doubanio.com/view/photo/s_ratio_poster/public/p2196211285.jpg,True,7046723,剧情 动作 科幻,美国,猩球崛起2：黎明之战,https://movie.douban.com/subject/7046723/,2014-08-29,37,241806,7.6,安迪·瑟金斯 杰森·克拉克 加里·奥德曼 凯丽·拉塞尔 托比·凯贝尔 柯蒂·斯密特-麦菲 柯克·埃斯沃多 尼克·瑟斯顿 泰瑞·诺塔里 卡琳·考诺娃 朱迪·格雷尔 乔恩·阿兹 恩里克·穆西安诺 拉勒米·道克·肖 李·罗斯 凯文·兰金 基尔·奥唐纳 隆巴多·博伊尔 约克·西姆斯 阿尔·维森特 穆斯塔法·哈里斯 J·D·埃弗摩尔 佩顿·威奇 迈克尔·帕帕约翰 杰夫·奎卡 克里斯托弗·贝瑞 安吉拉·克勒科兹 史蒂文·韦格 提摩西·怀安特 约翰·阿米乔 蒂莫西·皮克勒斯 迪索·拉莫斯 里奇·J·拉德纳 杰拉尔丁·格伦 凯瑞·西蒙斯 莫尼卡·雷内·安德森 爱德华·J·克莱尔,False
7.6 40,512,https://img3.doubanio.com/view/photo/s_ratio_poster/public/p1617867110.jpg,True,1308570,动作 科幻 冒险,美国,蜘蛛侠2,https://movie.douban.com/subject/1308570/,2004-08-05,71,202162,7.6,托比·马奎尔 克斯汀·邓斯特 詹姆斯·弗兰科 阿尔弗雷德·莫里纳 罗斯玛丽·哈里斯 J·K·西蒙斯 唐纳·墨菲 丹尼尔·吉里斯 迪伦·贝克 比尔·努恩 范妮莎·费丽托 阿西夫·曼德维 威廉·达福 克里夫·罗伯逊 泰德·雷米 布鲁斯·坎贝尔  斯坦·李 伊丽莎白·班克斯 乔尔·麦克哈尔 山姆·雷米 哈尔·斯帕克斯 艾米丽·丹斯切尔 布兰娜·布朗 佩顿·李斯特 约翰·兰迪斯 金大贤 邦妮· 萨默维尔 里德·戴蒙德 乔伊·布赖恩特 马吉纳·托娃 布兰特·布里斯科 菲尔·拉马 斯科特·斯皮格尔 皮特·麦克罗比 莫莉·曲克 斯宾塞·李斯特 克里斯汀·艾斯布鲁克 金锋 张欣迪 乔安娜·巴隆 路易斯·隆巴迪 Roshon Fegan 格雷格·埃德尔曼 克洛伊·戴克斯特拉 埃利亚·巴斯金 马克·约翰·杰弗瑞 安妮·贝坦克特 Claudia Katz 加雷特·瓦伦 Tim Storms 苏西·帕克 卢·沃尔普 Lorelei Llee Jill Sayre Vince Cupone 法布里奇奥·范特 丹·希克斯 比尔·卡尔弗特 蒂莫西·杰尔姆 Kelly Connell Scott Skversky Phillip Gramm Peter Cincotti Ken Wharton Christopher Porto John Thurner Jopaul Epp Weston Epp 特洛伊·梅特卡夫 Mohammed Hassan Damian Bailey,False
7.6 40,513,https://img3.doubanio.com/view/photo/s_ratio_poster/public/p2230029851.jpg,True,1401524,动作 科幻 惊悚,美国 加拿大 英国,X战警3：背水一战,https://movie.douban.com/subject/1401524/,2006-09-08,57,194286,7.6,休·杰克曼 哈莉·贝瑞 伊恩·麦克莱恩 帕特里克·斯图尔特 法米克·詹森 安娜·帕奎因 凯尔希·格兰莫 詹姆斯·麦斯登 丽贝卡·罗梅恩 肖恩·阿什莫 艾伦·佩吉 本·福斯特 亚伦·斯坦福 朱利安·瑞钦斯 凯登·博伊德 Omahyra Connor Widdows 维尼·琼斯 Dan McPeake 约翰·派珀-弗格森 梅·梅纳康 谢拉赫·霍斯达尔 Ron Blecker Richard Yee Luke Pohl 斯坦·李 布莱斯·霍吉森 麦肯兹·韦加 布雷纳·奥布莱恩 阿德里安·霍夫 丹尼斯·科贝特 约瑟夫·索默 卡梅隆·布莱特 肯·梁 丹尼尔·库德摩尔 迈克尔·墨菲 坦尼娅·纽堡尔德 丹妮亚·拉米雷兹 埃里克·迪恩 马克·海尔弗里奇 安东尼·希尔德 艾伦·坡尔 索瑞·安达斯鲁 阿莱克斯·费瑞斯 李·厄米 瑞恩·肯尼思·金 Mi-Jung Lee 奥莉维亚·威廉姆斯 Chris Duchaine Zoltan Buday 比尔·杜克 Geoff White 托尼·斯蒂夫阿诺 克里斯·克雷蒙 Lloyd Adams 哈莉·拉姆 克里斯托弗·福什,False
7.6 40,514,https://img9.doubanio.com/view/photo/s_ratio_poster/public/p1327387815.jpg,True,4051753,动作 犯罪 悬疑,美国,大侦探福尔摩斯2：诡影游戏,https://movie.douban.com/subject/4051753/,2012-01-15,16,190237,7.6,小罗伯特·唐尼 裘德·洛 瑞秋·麦克亚当斯 劳米·拉佩斯 斯蒂芬·弗雷 凯利·蕾莉 杰瑞德·哈里斯 杰拉丁妮·詹姆斯 威廉·休斯顿 保罗·安德森 劳伦斯·波萨 弗拉基米尔·弗迪克 丹尼尔·纳普勒斯 埃迪·马森 杰克·拉斯基 蒂埃里·钮维,False
7.6 40,515,https://img1.doubanio.com/view/photo/s_ratio_poster/public/p664164947.jpg,True,1308848,动作 冒险 悬疑 惊悚,美国,国家宝藏,https://movie.douban.com/subject/1308848/,2004-11-19,52,130985,7.6,尼古拉斯·凯奇 黛安·克鲁格 贾斯汀·巴萨 肖恩·宾 强·沃特 哈威·凯特尔 克里斯托弗·普卢默 大卫·达耶·费舍尔 Stewart Finlay-McLennan 欧勒格·塔克塔罗夫 Stephen A. Pope 安妮·帕里西 马克·佩雷格里诺 阿曼德·里斯科 埃里克·金 Sheila Thomas Blaze Kelly Coyle Keyon Smith Colleen Dengel 张磊 Suzanne Dengel Joe Rampino Michael Russo Chris McMullin 尼克·本森 Neal Orion 詹姆斯·比贝里 Gavin Black Antony Alda 托尼·德文 杰森·厄尔斯 亨特·戈麦斯 小托尼·卢克 亚历山大·埃默特 托尼·斯威夫特 约书亚·比顿 Terrence Currier Daniel Ferro Chrismandu Kym Cohen Jackson Bolt Jonathon Ruckman Ryan Tygh 路易斯·森坦尼 Jenni Lileikis Deborah Yates Tony Sagastizado I 罗德·麦克拉兰 Yoshi Jenkins 罗德尼·J·霍布斯 阿拉贝拉·菲尔德 罗恩·坎纳达,False
7.6 40,516,https://img1.doubanio.com/view/photo/s_ratio_poster/public/p790087797.jpg,False,1418190,剧情 动作 惊悚 冒险,英国 捷克 美国 德国 巴哈马,007：大战皇家赌场,https://movie.douban.com/subject/1418190/,2007-01-30,41,129145,7.6,丹尼尔·克雷格 伊娃·格林 麦斯·米科尔森 朱迪·丹奇 杰弗里·怀特 吉安卡罗·吉安尼尼 Ivan G'Vera 卡洛斯·李尔 托玛斯·博·拉森 伊萨赫·德·班克尔 Jan Loukota 亚历桑德拉·安布罗休 克劳迪奥·桑塔玛利亚 Peter Notley 迈克尔·G·威尔森 理查德·布兰森 冈瑟·冯·哈根斯 西蒙·阿布卡瑞安 加斯帕·克里斯滕森 马尔科姆·辛克莱 Jürgen Tarrach 拉扎尔·里斯托夫斯基 托比亚斯·门基斯 卡特琳娜·莫里诺 Ben Cooke 汤姆·查本 Phil Meheux 乌尔巴诺·巴尔贝里尼 克里斯平 伯汉姆-卡特 米切尔奥菲 伊万娜·米利塞维奇 Sebastien Foucan 委拉斯提娜斯瓦特库娃 Michaela Ochotská 路德格·皮斯特 Regina Gabajová Miroslav Simunek 周采芹 克里斯蒂娜·科尔 马丁·坎贝尔 范若施卡·冯·兰朵夫,False
7.6 40,517,https://img1.doubanio.com/view/photo/s_ratio_poster/public/p2165828468.jpg,True,1299745,喜剧 动作,中国香港,破坏之王,https://movie.douban.com/subject/1299745/,1994-02-03,23,116886,7.6,周星驰 吴孟达 钟丽缇 林国斌 李力持 古巨基 郑祖 黄一山 黄一飞 林雪 张学友 梁荣忠 谷德昭 黎彼得 秦沛 郑家生 周比利 侯焕玲 陈欣健 胡立成 余袁稳 张镭 邓泰和,False
7.6 40,518,https://img1.doubanio.com/view/photo/s_ratio_poster/public/p1259571118.jpg,True,1293702,动作 冒险 科幻 惊悚,美国,侏罗纪公园2：失落的世界,https://movie.douban.com/subject/1293702/,1997-08-07,29,112211,7.6,杰夫·高布伦 朱丽安·摩尔 皮特·波斯尔思韦特 艾利斯·霍华德 理查德·阿滕伯勒 文斯·沃恩 凡妮莎·李·彻斯特 彼得·斯特曼 哈维·杰森 理查德·希夫 约瑟夫·梅泽罗 阿丽亚娜·理查兹 小托马斯·罗萨莱斯 卡米拉·贝勒 比利·布朗 罗宾·萨奇斯 罗斯·帕特里奇 伊安·艾伯克龙比 戈登·迈克尔斯 科尔顿·詹姆斯 大卫·圣.詹姆斯 沈晓谦 史蒂文·斯皮尔伯格 格诺·席尔瓦 Alex Miranda 艾伦·D·柏温 J.帕特里克·麦克康尔马克 马克·佩雷格里诺 伊莱·罗斯,False
7.6 40,519,https://img1.doubanio.com/view/photo/s_ratio_poster/public/p2210801408.jpg,False,25798131,动作 犯罪 惊悚,美国,疾速追杀,https://movie.douban.com/subject/25798131/,2014-10-24,24,110636,7.6,基努·里维斯 迈克尔·恩奎斯特 阿尔菲·艾伦 威廉·达福 迪恩·文特斯 阿德琳妮·帕里奇 奥默·巴尼亚 托比·莱昂纳德·摩尔 丹尼尔·伯哈特 布丽姬·穆娜 约翰·雷吉扎莫 伊恩·麦柯肖恩 布里吉特·瑞根 兰斯·莱迪克 基思·雅各 托马斯·萨多斯基 克拉克·彼得斯 兰德尔·杜克·金 凯文·纳什 大卫·帕特里克·凯利 波·沙都 纳迪娅·凯 凡妮莎·万德·普卢姆 J·J·佩里,False
7.6 40,520,https://img9.doubanio.com/view/photo/s_ratio_poster/public/p2199638985.jpg,True,10598440,动作 悬疑 惊悚 灾难,英国 法国 美国,空中营救,https://movie.douban.com/subject/10598440/,2014-09-19,23,108328,7.6,连姆·尼森 朱丽安·摩尔 斯科特·麦克纳里 米歇尔·道克瑞 内特·派克 寇瑞·斯托尔 露皮塔·尼永奥 奥玛尔·梅特瓦利 杰森·巴特勒·哈纳 莱纳斯·罗彻 谢伊·惠格姆 安松·蒙特 奎恩·麦克科甘 科里·霍金斯 弗兰克·迪尔 芭儿·帕丽 爱德华多·科斯塔 乔恩·亚伯拉罕斯 阿曼达·奎德 拉尔斯·格哈德 维多利亚·阿比特 菲尼斯·埃弗里 安德鲁·艾伯森,False
7.6 40,521,https://img3.doubanio.com/view/photo/s_ratio_poster/public/p1693861981.jpg,True,1301345,动作 犯罪 惊悚,美国,偷天换日,https://movie.douban.com/subject/1301345/,2003-05-30,19,103263,7.6,马克·沃尔伯格 查理兹·塞隆 爱德华·诺顿 唐纳德·萨瑟兰 杰森·斯坦森 茅斯·达夫 赛斯·格林 凯莉·布鲁克 弗兰基·G 奥莱克·克鲁帕 玛丽·波特西尔 奥斯卡·努内斯 马蒂·瑞恩 鲍里斯·李·库尔通格 约翰托宾 童自荣 西蒙·瑞 Melanie Jayne 斯科特·安第斯,False
7.6 40,522,https://img3.doubanio.com/view/photo/s_ratio_poster/public/p2521404612.jpg,True,1307389,动作 冒险 喜剧,英国 法国 美国,憨豆特工,https://movie.douban.com/subject/1307389/,2003-09-12,24,88284,7.6,罗温·艾金森 约翰·马尔科维奇 娜塔莉·安博莉亚 彼得·休伊特 格雷·怀斯 海莉·埃克 塔莎·德·瓦斯康赛洛丝 劳伦斯·理查德森 童自荣 塔尼娅·戴维斯 厄俄斯·蔡特 詹姆斯·恩布里 盖·耶·韦斯特霍夫 Norman Campbell Rees 克里斯·塔伦特 内维尔·菲利普斯 蒂姆·皮戈特-史密斯 法鲁克·普鲁提 凯文·麦克纳利 特雷弗·麦克唐纳 本·米勒 詹姆斯·格林尼 奥利弗·福德·戴维斯 道格拉斯·迈克弗兰,False
7.6 40,523,https://img9.doubanio.com/view/photo/s_ratio_poster/public/p2527205786.jpg,False,27003543,动作 奇幻,韩国,与神同行2：因与缘,https://movie.douban.com/subject/27003543/,2018-08-01,22,81931,7.6,河正宇 朱智勋 马东锡 金香起 李政宰 赵汉哲 金明坤 金东旭 郑惟安 都暻秀 姜在恩 吴熙俊 李璟荣 洪仁 姜珉 闵武济 崔贤钟 申载敏 南一祐 郑志薰 金泰俊 林韩傧,False
7.6 40,524,https://img3.doubanio.com/view/photo/s_ratio_poster/public/p1386400723.jpg,True,1295064,动作 喜剧 爱情,中国香港 日本,城市猎人,https://movie.douban.com/subject/1295064/,1993-01-16,18,74563,7.6,成龙 王祖贤 邱淑贞 后藤久美子 单立文 黎明 王敏德 葛民辉 唐宁 卢惠光 温翠苹 林海峰 孟海 盖瑞·丹尼尔斯 段伟伦 麦克·里德 政宗一成 理查德·诺顿,False
7.6 40,525,https://img3.doubanio.com/view/photo/s_ratio_poster/public/p1397968890.jpg,True,1297068,剧情 动作,中国香港,中南海保镖,https://movie.douban.com/subject/1297068/,1994-07-28,15,71890,7.6,李连杰 钟丽缇 郑则仕 邹兆龙 梁荣忠 黄锦江 元奎 伍卫国 Tom Konkle 约翰·德米塔 Arianna Ratner Dean Scofield 迈克尔·索里奇 基思·弗格森 江苗定,False
7.6 40,526,https://img9.doubanio.com/view/photo/s_ratio_poster/public/p987138955.jpg,True,2174535,动作 冒险 惊悚,美国,天龙特攻队,https://movie.douban.com/subject/2174535/,2010-06-11,10,71272,7.6,连姆·尼森 布莱德利·库珀 沙尔托·科普雷 奎顿·杰克逊 杰西卡·贝尔 帕特里克·威尔森 大卫·哈金斯 布兰登·佩尼 尤尔·瓦斯克斯 亚历克斯·麦迪逊,False
7.6 40,527,https://img1.doubanio.com/view/photo/s_ratio_poster/public/p722782989.jpg,True,1473074,动作 剧情,中国香港,古惑仔2之猛龙过江,https://movie.douban.com/subject/1473074/,1996-03-30,23,70142,7.6,郑伊健 陈小春 黎姿 邱淑贞 林晓峰 谢天华 朱永棠 黄秋生 任达华 雷震 柯受良 谭小环 陈豪 蔡业信 李道谕 程小龙 黄金棠 邵萱 刘宝贤 李兆基 林尚义 李力持 罗伟佳,False
7.6 40,528,https://img1.doubanio.com/view/photo/s_ratio_poster/public/p1101480167.jpg,True,1299153,动作 科幻 恐怖,美国,异形4,https://movie.douban.com/subject/1299153/,1997-11-06,23,69042,7.6,西格妮·韦弗 薇诺娜·瑞德 多米尼克·皮侬 朗·普尔曼 加里·杜尔丹 迈克尔·维克特 金·馥拉蕊 丹·哈达亚 J·E·弗里曼 布拉德·道里夫 雷蒙德·克鲁斯 利兰·奥瑟 大卫·圣.詹姆斯 Brad Martin 汤姆·伍德鲁夫 Eddie Yansick 户田惠子 克里斯·丹尼齐奥 Joan LaBarbara 斯蒂芬·吉尔伯恩 大卫·普瑞尔 丹尼尔·雷蒙特 尼托·拉里奥萨,False
7.6 40,529,https://img3.doubanio.com/view/photo/s_ratio_poster/public/p2524056711.jpg,False,26602900,动作 悬疑,韩国,魔女,https://movie.douban.com/subject/26602900/,2018-06-27,40,65082,7.6,金多美 赵敏修 朴熙顺 崔宇植 高敏诗 吴美姬 崔政宇 多恩 金秉玉 李柱元 金河娜 李基英 权泰元 李时勋  白承哲 袁民奎 金宗勋 徐翰洁  Jeong-goo Seo 高奉久 金道爀 朴向勋 吕茂英  李时宇 金孝珍 Hyeok-seong Kwon  Gwang-hee Jo 金永 崔贤钟 申载敏 金基政 李夏英 Seung-yoon Han  李圣贤 宋亨秀 郑雨琳 金龙云 玄奉植 白钟焕 郭振锡,False
7.6 40,530,https://img9.doubanio.com/view/photo/s_ratio_poster/public/p792496425.jpg,True,1295120,动作 历史 战争,美国,风语者,https://movie.douban.com/subject/1295120/,2002-06-14,20,63556,7.6,尼古拉斯·凯奇 亚当·比奇 彼得·斯特曼 诺亚·艾默里奇 马克·鲁弗洛 布莱恩·范·霍尔特 马丁·亨德森 弗兰西丝·奥康纳 克里斯蒂安·史莱特 詹森·艾萨克 凯文·库尼 霍尔姆斯·奥斯本 卡梅伦·索尔 Roger Willie 詹姆斯·霍纳 杰雷米·戴维森 克莱顿·巴伯 丹尼·皮尔斯 小泽吉郎 Keii Johnston,False
7.6 40,531,https://img3.doubanio.com/view/photo/s_ratio_poster/public/p1387691770.jpg,True,1296693,喜剧 动作,中国香港,醉拳,https://movie.douban.com/subject/1296693/,1978-10-05,21,51496,7.6,成龙 黄正利 石天 王憾尘 李春华 谭宝 唐晶 蔡晖 罗强 黄哈 山怪 林瑛 杨盼盼 袁信义 袁小田 徐虾 李超俊 冯敬文 袁和平 袁振洋 王将,False
7.6 40,532,https://img3.doubanio.com/view/photo/s_ratio_poster/public/p2408355680.jpg,True,1304726,喜剧 动作 犯罪,中国香港,警察故事续集,https://movie.douban.com/subject/1304726/,1988-08-20,34,42441,7.6,成龙 张曼玉 陈国新 楚原 曹查理 王伟 黄曼凝 商天娥 詹秉熙 叶荣祖 董骠 张午郎 梁韵蕊 麦天恩 李忠志 韩春 甘国卫 周文健 太保 焦姣 何家劲 卢惠光 火星 郭锦恩 午马 关山 江欣燕 林国斌 楼南光 黎强权 吴声发 戴志伟 刘兆铭 刘青云,False
7.6 40,533,https://img3.doubanio.com/view/photo/s_ratio_poster/public/p2233939993.jpg,True,1296203,喜剧 动作 犯罪,中国香港,警察故事3：超级警察,https://movie.douban.com/subject/1296203/,1992-07-04,18,41839,7.6,成龙 杨紫琼 张曼玉 曾江 元华 董骠 金佩恩 唐季礼 麦伟章 段伟伦 林富伟 林志泰 罗烈 顾美华 沈威 王霄 陈欣健 卢惠光,False
7.6 40,534,https://img3.doubanio.com/view/photo/s_ratio_poster/public/p948510953.jpg,False,2080007,动作 犯罪 惊悚,美国,金刚不坏,https://movie.douban.com/subject/2080007/,2007-07-21,16,41441,7.6,库尔特·拉塞尔 佐伊·贝尔 罗莎里奥·道森 范妮莎·费丽托 西德尼·塔米娅·波蒂埃 翠茜·索姆斯 罗丝·麦高恩 乔丹·莱德 玛丽·伊丽莎白·温斯特德 昆汀·塔伦蒂诺 伊莱·罗斯 奥玛·杜姆 迈克尔·巴考尔 莫妮卡·斯塔吉丝 玛丽·谢尔顿 马西·哈里尔,False
7.6 40,535,https://img3.doubanio.com/view/photo/s_ratio_poster/public/p779017072.jpg,True,1293142,动作 犯罪 惊悚,中国香港,新上海滩,https://movie.douban.com/subject/1293142/,1996-07-13,12,40095,7.6,张国荣 刘德华 宁静 李蕙敏 吴兴国 刘洵 黄佩霞 李健仁 郑雨盛 叶进 张济平 曹秋根,False
7.6 40,536,https://img3.doubanio.com/view/photo/s_ratio_poster/public/p2404938183.jpg,False,26169607,动作 惊悚 灾难,韩国,潘多拉,https://movie.douban.com/subject/26169607/,2016-12-07,31,38195,7.6,金南佶 金珠贤 郑镇荣 金英爱 文晶熙 金大明 李璟荣 姜信日 刘承睦 金明民 车明旭 Min Suk Kwak 孔政焕 崔昇勋 柳在勋 金正洙 柳起山 裴康琉 吴艺雪 金锦顺 金建 李泰亨 郭仁俊 宋英奎 罗文姬 李胜浚 周锡泰 金英熊 孙钟学 赵德贤 姜珉,False
7.6 40,537,https://img1.doubanio.com/view/photo/s_ratio_poster/public/p2496564367.jpg,False,26946510,动作 犯罪,韩国,犯罪都市,https://movie.douban.com/subject/26946510/,2017-10-03,44,36759,7.6,马东锡 尹启相 赵在允 崔奎华 林炯俊 陈善圭 洪基俊 许栋元 河俊 金成圭 朴智焕 许成泰 闵庆珍 尹炳熙 李相元 郑仁基 严智星 白仁权 裴振雄 韩成天 金久澤 金旲兴 崔成宰 赵震雄 允珠 俞智妍 朴相奎 裴真雅 郑载宪  琴光山 金茂 尹大烈 闵武济 芮呈和 李奎浩 Kwon Jin-woo  金光炫 申基禄 Kim Yoon-bae 李晟宇 郑仁谦 Lee Tae-gyoo 郑亨锡 高恩伊,False
7.6 40,538,https://img1.doubanio.com/view/photo/s_ratio_poster/public/p775111908.jpg,True,2138299,动作 犯罪 惊悚,英国 美国 法国,摇滚黑帮,https://movie.douban.com/subject/2138299/,2008-09-05,34,32353,7.6,杰拉德·巴特勒 汤姆·威尔金森 坦迪·牛顿 马克·斯特朗 伊德里斯·艾尔巴 汤姆·哈迪 卡瑞尔·罗登 托比·凯贝尔 杰里米·皮文 卢达克里斯 吉米·米斯特雷 马特·金 杰夫·贝尔 德拉甘·米恰诺维奇 迈克尔·瑞安 侬索·阿诺斯 杰玛·阿特登 大卫·巴克·琼斯 戴维·里昂 布隆森·韦伯 杰米·坎贝尔·鲍尔 詹姆斯·格林尼 乔安娜·培根 约翰尼·哈里斯 蒂凡妮·穆赫隆 本·卡普兰 本·霍姆伍德 大卫·斯特恩 奥利弗·迪姆斯戴尔 布莱克·瑞特森 莫恩博特斯 劳伦斯·理查德森 盖·里奇 约翰·范维伦,False
7.6 40,539,https://img3.doubanio.com/view/photo/s_ratio_poster/public/p2361154441.jpg,False,10774184,动作 西部 冒险,美国,豪勇七蛟龙,https://movie.douban.com/subject/10774184/,2016-09-08,28,32265,7.6,丹泽尔·华盛顿 克里斯·帕拉特 马特·波莫 伊桑·霍克 文森特·多诺费奥 海莉·贝内特 彼得·萨斯加德 肖恩·布里吉格斯 凯姆·吉甘戴 卢克·葛莱姆斯 李秉宪 威廉姆·李·斯科特 迪兰·科宁 比利·斯洛特 小托马斯·布莱克 格里夫·弗斯特 曼努埃尔·加西亚-鲁尔福 迈克·加萨威 大卫·曼扎纳雷斯 弗兰克·鲍沃斯 埃姆利·贝赫什蒂 马丁·桑斯梅耶 罗布·梅洛 克林特·詹姆斯 肖恩·博伊德 乔迪·马林斯 杰米·格里登 凯文·韦恩,False
7.6 40,540,https://img9.doubanio.com/view/photo/s_ratio_poster/public/p2243764496.jpg,True,1300399,动作 冒险,美国,第一滴血3,https://movie.douban.com/subject/1300399/,1988-05-25,10,31368,7.6,西尔维斯特·史泰龙 理查德·克里纳 马克.德.容 柯特伍德·史密斯 塞森·加布埃 阿隆·阿布布尔 Paul Dion Monte Doudi Shoua 约瑟夫·希洛赫 R.T. Freeman,False
7.6 40,541,https://img9.doubanio.com/view/photo/s_ratio_poster/public/p2235503534.jpg,True,1306011,动作 喜剧,中国香港,最佳拍档,https://movie.douban.com/subject/1306011/,1982-01-16,23,23464,7.6,许冠杰 麦嘉 张艾嘉 石天 古嘉露 徐克 曹达华 林子祥 黄百鸣 陈星 吴浣仪 陈令智 余慕莲 冯敬文 何柏光 金彪  李鹏飞 彭润祥 冯润泉 泰山 成运安 杜少明 戚毅雄,False
7.6 40,542,https://img9.doubanio.com/view/photo/s_ratio_poster/public/p2552948815.jpg,False,1401129,动作 武侠 古装 情色,中国香港,唐朝豪放女,https://movie.douban.com/subject/1401129/,1984-06-01,11,17593,7.6,夏文汐 万梓良 张国柱 谷峰 江涛 许莹英 陈家奇 潘震伟 林凯玲 王莱 姚文基,False
7.6 40,543,https://img3.doubanio.com/view/photo/s_ratio_poster/public/p2192985822.jpg,True,1304837,动作 犯罪 爱情,中国香港,爆裂刑警,https://movie.douban.com/subject/1304837/,1999-08-05,15,17456,7.6,吴镇宇 古天乐 郑雪儿 罗兰 邹凯光 黄德斌 林美贞 李耀明 黄金棠 朱婉仪 麦咏麟 李栋全 黎耀祥 何华超 罗莽,False
7.6 40,544,https://img9.doubanio.com/view/photo/s_ratio_poster/public/p1994722564.jpg,True,2127388,喜剧 动作 奇幻,中国香港,灵幻先生,https://movie.douban.com/subject/2127388/,1987-12-17,17,15515,7.6,林正英 吴耀汉 午马 洪金宝 王玉环 刘秋生 叶荣祖 谭一清 班润生 彭润祥 张荣祥 萧红梅 何健威 吕方 楼南光 元奎 林富伟,False
7.6 40,545,https://img1.doubanio.com/view/photo/s_ratio_poster/public/p2162764447.jpg,True,1299667,喜剧 动作 奇幻,中国香港,驱魔警察,https://movie.douban.com/subject/1299667/,1990-11-02,10,15265,7.6,林正英 苗侨伟 林俊贤 王美华 西协美智子 午马 周比利 陈治良 侯焕玲 彭润祥,False
7.6 40,546,https://img3.doubanio.com/view/photo/s_ratio_poster/public/p1898841633.jpg,True,1297260,动作 喜剧 犯罪 惊悚,美国 德国,笨贼妙探,https://movie.douban.com/subject/1297260/,1999-11-18,31,15055,7.6,马丁·劳伦斯 卢克·威尔逊 威廉·弗西斯 埃迪·多诺 埃里克·罗德尔 艾米·奥博瑞 妮可·阿丽·帕克 奥克塔维亚·斯宾瑟 斯科特·索尔斯 Ty Williams Damian Foster Troy Gilbert 胡里奥·奥斯卡·门乔索 罗伯特·拉萨多 理查德·C·萨拉菲安 弗兰克·梅德拉诺 塔玛拉·琼斯 James W. Gavin 彼得·格林纳 克里斯托弗·斯塔普勒顿 Rocco Salata 贾森·克拉维茨 卡门·阿尔根齐亚诺 Joel Hurt Jones 约翰·浩克斯 安妮·玛丽·霍华德 萨韦里奥·格拉 Brandon de Paul 大卫·查普尔 简·卡尔 格拉汉姆·贝克尔,False
7.6 40,547,https://img9.doubanio.com/view/photo/s_ratio_poster/public/p2224229425.jpg,False,26252157,喜剧 动作,日本,龙三和他的七人党,https://movie.douban.com/subject/26252157/,2015-04-25,16,14887,7.6,藤龙也 樋浦勉 胜村政信 川野直辉 北野武 近藤正臣 万田久子 中尾彬 小野寺昭 清水富美加 下条阿童木 品川彻 安田显 吉泽健 濑户夏实 矢岛健一,False
7.6 40,548,https://img3.doubanio.com/view/photo/s_ratio_poster/public/p2559075183.jpg,True,1968502,动作 武侠 古装,中国大陆,陆小凤传奇之大金鹏王,https://movie.douban.com/subject/1968502/,2007-01-17,7,12967,7.6,刘诗诗 张智霖 张智尧 吴佳尼 邵万林 何润东 张磊,False
7.6 40,549,https://img1.doubanio.com/view/photo/s_ratio_poster/public/p2028302298.jpg,True,1297683,动作 犯罪 剧情 悬疑,中国香港,野兽刑警,https://movie.douban.com/subject/1297683/,1998-04-09,13,12929,7.6,黄秋生 王敏德 张耀扬 周海媚 李灿森 谭耀文 车婉婉 黄金棠 蔡业信 金刚 刘秋生 梁焯满 黄岳泰,False
7.6 40,550,https://img9.doubanio.com/view/photo/s_ratio_poster/public/p2235487996.jpg,True,1306606,剧情 动作 历史 战争,美国 德国,我们曾是战士,https://movie.douban.com/subject/1306606/,2002-03-01,45,12836,7.6,梅尔·吉布森 格雷戈·金尼尔 玛德琳·斯托 山姆·艾里奥特 凯丽·拉塞尔 克里斯·克莱因 巴里·佩珀 阮明智 F. Lee Reynolds Sloane Momsen 贝拉米·扬 马特·曼格姆 Michael Giordani 贾斯汀·戈登 Chris Cate Christian Gibson Sean Bunch Mike White 布莱恩·泰 丹尼尔·洛巴克 戴文·沃克海瑟 乔恩·哈姆 贾苏·加西亚 埃里克·麦克阿瑟 戴斯蒙德·哈灵顿 泰勒·摩森 马克·布鲁卡斯 提姆·阿贝尔 克拉克·格雷格 Andrew Wallace 迪伦·沃尔什 基斯·斯扎拉巴基克 Forry Smith Steven Nelson Jason Powell Edwin Morrow 马克·麦克拉肯 斯姆比·卡哈利 Shepard Koster Will Klipstine 瑞恩·赫斯特 布莱克·赫伦 丹阳 乔什·多尔蒂 卢克·本沃德,False
7.6 40,551,https://img3.doubanio.com/view/photo/s_ratio_poster/public/p2166041332.jpg,True,1299658,动作 犯罪 剧情 惊悚,中国香港,龙虎风云,https://movie.douban.com/subject/1299658/,1987-02-13,15,12778,7.6,周润发 李修贤 孙越 吴家丽 张耀扬 徐锦江 钱荣威 伍国健 韩坤 黄柏文 陈志辉 Tom Konkle 玛利亚 黄光亮 刘江,False
